<?xml version="1.0" encoding="UTF-8"?>
<tns:Cinema xmlns:tns="http://www.example.org/cinema" xmlns:xsi="http://www.w3.org/2001/XMLSchema-instance" xsi:schemaLocation="http://www.example.org/cinema cinema.xsd ">
  <tns:Film id="lb78" type="comedie">
    <tns:titre>Les Bronzes</tns:titre>
    <tns:annee>1978</tns:annee>
    <tns:realisateur>Patrice Leconte</tns:realisateur>
  </tns:Film>
 
  
  
  <tns:Producteur>
    <tns:nom>Daniel Toscan du Plantier</tns:nom>
    <tns:Film>
      <tns:titre>Les Bronzes</tns:titre>
      <tns:annee>1978</tns:annee>
      <tns:realisateur>Patrice Leconte</tns:realisateur>
    </tns:Film>
  </tns:Producteur>
</tns:Cinema>
